{
  "class": {
    "type": "fmu_ensemble",
    "class_version": "0.8"
  },
  "source": "fmu",
  "user": "peesv",
  "datetime": "2020-06-26 09:28:32",
  "field_id": {
    "field_name": "JOHAN SVERDRUP",
    "field_guid": 268281971
  },
  "country_identifier": "Norway",
  "fmu_ensemble": {
    "fmu_ensemble_id": "e00a862d-06f8-4ff9-a19f-9eaf09cc8c87",
    "case": "MyCaseName",
    "iteration": "iter-0",
    "runs": [
      {
        "user": "peesv",
        "datetime": "2020-06-26 09:28:32",
        "configpath": "/project/johan_sverdrup/resmod/...",
        "runpath": "/scratch/johan_sverdrup/..."
      },
      {
        "user": "someuser",
        "datetime": "2020-06-26 09:52:02",
        "configpath": "/project/johan_sverdrup/resmod/...",
        "runpath": "/scratch/johan_sverdrup/..."
      }
    ]
  },
  "fmu_template": {
    "description": "The continously updated full field reservoir model for Johan Sverdrup.",
    "workflow_manager": "ert",
    "workflow_manager_version": "2.2.1",
    "stratigraphic_column": "JOHAN SVERDRUP 2015",
    "model_name": "ff",
    "model_revision": "2020a b007.1.0",
    "static_model_software": "rms",
    "static_model_software_version": "10.1.3",
    "simulator": "eclipse",
    "simulator_version": "xx"
  },
  "coordinate_reference_system": {
    "base_system": "WGS84",
    "central_meridian": 3,
    "datum": "OW_European_Datum_1950",
    "hemisphere": "Northern",
    "name": "ST_ED50_UTM31N_P23031_T1133",
    "projection": "UTM",
    "zone": 31,
    "epsg_version": 8,
    "epsg_code": 23031
  }
}
